Location|1
Environment|2
Technology-specific Environment Issues|3
J2EE Environment Issues|4
J2EE Misconfiguration: Data Transmission Without Encryption|5
J2EE Misconfiguration: Insufficient Session-ID Length|6
J2EE Misconfiguration: Missing Custom Error Page|7
J2EE Misconfiguration: Entity Bean Declared Remote|8
J2EE Misconfiguration: Weak Access Permissions for EJB Methods|9
ASP.NET Environment Issues|10
ASP.NET Misconfiguration: Creating Debug Binary|11
ASP.NET Misconfiguration: Missing Custom Error Page|12
ASP.NET Misconfiguration: Password in Configuration File|13
Compiler Removal of Code to Clear Buffers|14
External Control of System or Configuration Setting|15
Configuration|16
Code|17
Source Code|18
Data Handling|19
Improper Input Validation|20
Pathname Traversal and Equivalence Errors|21
Improper Limitation of a Pathname to a Restricted Directory ('Path Traversal')|22
Relative Path Traversal|23
Path Traversal: '../filedir'|24
Path Traversal: '/../filedir'|25
Path Traversal: '/dir/../filename'|26
Path Traversal: 'dir/../../filename'|27
Path Traversal: '..\filedir'|28
Path Traversal: '\..\filename'|29
Path Traversal: '\dir\..\filename'|30
Path Traversal: 'dir\..\..\filename'|31
Path Traversal: '...' (Triple Dot)|32
Path Traversal: '....' (Multiple Dot)|33
Path Traversal: '....//'|34
Path Traversal: '.../...//'|35
Absolute Path Traversal|36
Path Traversal: '/absolute/pathname/here'|37
Path Traversal: '\absolute\pathname\here'|38
Path Traversal: 'C:dirname'|39
Path Traversal: '\UNC share name' (Windows UNC Share)|40
Improper Resolution of Path Equivalence|41
Path Equivalence: 'filename.' (Trailing Dot)|42
Path Equivalence: 'filename....' (Multiple Trailing Dot)|43
Path Equivalence: 'file.name' (Internal Dot)|44
Path Equivalence: 'file...name' (Multiple Internal Dot)|45
Path Equivalence: 'filename ' (Trailing Space)|46
Path Equivalence: ' filename' (Leading Space)|47
Path Equivalence: 'file name' (Internal Whitespace)|48
Path Equivalence: 'filename/' (Trailing Slash)|49
Path Equivalence: '//multiple/leading/slash'|50
Path Equivalence: '/multiple//internal/slash'|51
Path Equivalence: '/multiple/trailing/slash//'|52
Path Equivalence: '\multiple\\internal\\backslash'|53
Path Equivalence: 'filedir\\' (Trailing Backslash)|54
Path Equivalence: '/./' (Single Dot Directory)|55
Path Equivalence: 'filedir*' (Wildcard)|56
Path Equivalence: 'fakedir/../realdir/filename'|57
Path Equivalence: Windows 8.3 Filename|58
Improper Link Resolution Before File Access ('Link Following')|59
UNIX Path Link Problems|60
UNIX Symbolic Link (Symlink) Following|61
UNIX Hard Link|62
Windows Path Link Problems|63
Windows Shortcut Following (.LNK)|64
Windows Hard Link|65
Improper Handling of File Names that Identify Virtual Resources|66
Improper Handling of Windows Device Names|67
Windows Virtual File Problems|68
Improper Handling of Windows ::DATA Alternate Data Stream|69
Mac Virtual File Problems|70
Apple '.DS_Store'|71
Improper Handling of Apple HFS+ Alternate Data Stream Path|72
External Control of File Name or Path|73
Improper Neutralization of Special Elements in Output Used by a Downstream Component ('Injection')|74
Failure to Sanitize Special Elements into a Different Plane (Special Element Injection)|75
Improper Neutralization of Equivalent Special Elements|76
Improper Neutralization of Special Elements used in a Command ('Command Injection')|77
Improper Neutralization of Special Elements used in an OS Command ('OS Command Injection')|78
Improper Neutralization of Input During Web Page Generation ('Cross-site Scripting')|79
Improper Neutralization of Script-Related HTML Tags in a Web Page (Basic XSS)|80
Improper Neutralization of Script in an Error Message Web Page|81
Improper Neutralization of Script in Attributes of IMG Tags in a Web Page|82
Improper Neutralization of Script in Attributes in a Web Page|83
Improper Neutralization of Encoded URI Schemes in a Web Page|84
Doubled Character XSS Manipulations|85
Improper Neutralization of Invalid Characters in Identifiers in Web Pages|86
Improper Neutralization of Alternate XSS Syntax|87
Argument Injection or Modification|88
Improper Neutralization of Special Elements used in an SQL Command ('SQL Injection')|89
Improper Neutralization of Special Elements used in an LDAP Query ('LDAP Injection')|90
XML Injection (aka Blind XPath Injection)|91
DEPRECATED: Improper Sanitization of Custom Special Characters|92
Improper Neutralization of CRLF Sequences ('CRLF Injection')|93
Improper Control of Generation of Code ('Code Injection')|94
Improper Neutralization of Directives in Dynamically Evaluated Code ('Eval Injection')|95
Improper Neutralization of Directives in Statically Saved Code ('Static Code Injection')|96
Improper Neutralization of Server-Side Includes (SSI) Within a Web Page|97
Improper Control of Filename for Include/Require Statement in PHP Program ('PHP Remote File Inclusion')|98
